 Acronym,Name,Link,Location,Submission deadline,Start date,Topics,Area
IUKM 2018,The Sixth International Symposium on Integrated Uncertainty in Knowledge Modelling and Decision Making,https://easychair.org/cfp/IUKM-2018,,"Sep 15, 2017","Mar 15, 2018","['applications', 'uncertainty management', 'knowledge modelling and decision making', 'data ming and machine learning']",Mathematics and Statistics
FoIKS 2018,Tenth International Symposium on Foundations of Information and Knowledge Systems,https://easychair.org/cfp/FoIKS_2018,"Budapest, Hungary","Dec 01, 2017","May 14, 2018","['theoretical computer science', 'databases', 'artificial intelligence', 'mathematical logic']",Mathematics and Statistics
JSC-DG&AR-SI 2018,Special Issue of the Journal of Symbolic Computation on Dynamic Geometry and Automated Reasoning,https://easychair.org/cfp/JSC-DG-AR-SI-2018,,"Feb 01, 2018",,"['automated reasoning', 'dynamic geometry', 'applications']",Mathematics and Statistics
ADSAA-BIOMED2017,Special issue for the journal Advances in Data Science and Adaptive Analysis - Adaptive Analysis Applied to Biomedical Data,https://easychair.org/cfp/ADSAA-BIOMED2017,,"Oct 31, 2017",,"['biomedical engineering', 'biomedical signal processing', 'adaptive data analysis', 'empirical mode decomposition']",Mathematics and Statistics
INSTR 2018,7TH INTERNATIONAL SYMPOSIUM ON TRANSPORT NETWORK RELIABILITY,https://easychair.org/cfp/INSTR2018,"Sydney, Australia","May 31, 2017","Jan 17, 2018","['supply chain', 'traffic network', 'network reliability', 'transport network reliability']",Mathematics and Statistics
M3HPCST-2018,Modern Mathematical Methods and High Performance Computing in Science & Technology,https://easychair.org/cfp/M3HPCST-2018,"Ghaziabad (UP) 201010, India","Aug 30, 2017","Jan 04, 2018","['high performance computing', 'numerical analysis', 'scientific computing', 'mathematical models for computer science']",Mathematics and Statistics
